"﻿变量名",typeSeqID,weight,group,desc,desc_tw,desc_en,desc_vn,desc_kr,choice1,choice1_tw,choice1_en,choice1_vn,choice1_kr,choice2,choice2_tw,choice2_en,choice2_vn,choice2_kr,choice3,choice3_tw,choice3_en,choice3_vn,choice3_kr,choice4,choice4_tw,choice4_en,choice4_vn,choice4_kr,answer,imgID
230,2,50,290,Shinx are cute Electric-type Pokémon. The end of the tail is very cute. What is the shape of the end?,小貓怪是可愛的電光精靈，尾巴的末端非常可愛，請問末端的形狀是？,Shinx are cute Electric-type Pokémon. The end of the tail is very cute. What is the shape of the end?,404,404,A yellow quadrangle,一個黃色的四角形,A yellow quadrangle,404,404,A yellow heart,一個黃色的愛心,A yellow heart,404,404,A yellow thunder,一個黃色的閃電,A yellow thunder,404,404,A yellow five-pointed star,一個黃色的五角星,A yellow five-pointed star,404,404,1,
231,2,50,291,"In the animation, which of the following Pokémon has not owned by Jessie?",動畫中，以下精靈中哪只武藏沒有擁有過？,"In the animation, which of the following Pokémon has not owned by Jessie?",404,404,Toxapex,超壞星,Toxapex,404,404,Wobbuffet,果然翁,Wobbuffet,404,404,Ekans,阿柏蛇,Ekans,404,404,Pumpkaboo,南瓜精,Pumpkaboo,404,404,1,
232,2,50,292,Which of the following mushroom like Pokémon are Fairy type?,以下蘑菇型精靈中哪只是妖精屬性的？,Which of the following mushroom like Pokémon are Fairy type?,404,404,Morelull,睡睡菇,Morelull,404,404,Shroomish,蘑蘑菇,Shroomish,404,404,Foongus,哎呀球菇,Foongus,404,404,Parasect,派拉斯特,Parasect,404,404,1,
233,2,50,293,Palossand is a Ghost and Ground type Pokémon. There is a very prominent red shovel on top of its head. What is the use of the shovel?,噬沙堡爺是幽靈和地面系精靈，頭頂上有一個很顯著的紅色鏟子，請問鏟子的用處是什麽？,Palossand is a Ghost and Ground type Pokémon. There is a very prominent red shovel on top of its head. What is the use of the shovel?,404,404,Has the function of radar,有著雷達的功能,Has the function of radar,404,404,"No effect, can be pull out",無作用，可以拔掉,"No effect, can be pull out",404,404,An exclusive weapon,一種專屬武器,An exclusive weapon,404,404,Attract children to play with themselves,吸引小孩子跟自己玩,Attract children to play with themselves,404,404,1,
234,2,50,294,There are many artificial Pokémons in the world of Pokémon. Which one of the following Pokémon is not artificial?,精靈世界中存在很多人造精靈，下面精靈中哪只不是人造的精靈？,There are many artificial Pokémons in the world of Pokémon. Which one of the following Pokémon is not artificial?,404,404,Mew,夢幻,Mew,404,404,Polygon,多邊獸,Polygon,404,404,Mewtwo,超夢,Mewtwo,404,404,Type: Null,屬性：空,Type: Null,404,404,1,
235,2,50,295,Many Pokémons are very lazy. Which of the following Pokémons is not very lazy?,有很多精靈都十分懶散，請問以下精靈中哪只不會很懶散？,Many Pokémons are very lazy. Which of the following Pokémons is not very lazy?,404,404,Pikachu,皮卡丘,Pikachu,404,404,Komala,樹枕尾熊,Komala,404,404,Snorlax,卡比獸,Snorlax,404,404,Slaking,請假王,Slaking,404,404,1,
236,2,50,296,Movie [I Choose You!] Who is the Pokémons hiding in the shadow of Ash?,劇場版動畫【就決定是你了！】中躲在小智影子裏的精靈是誰？,Movie [I Choose You!] Who is the Pokémons hiding in the shadow of Ash?,404,404,Marshadow,瑪夏多,Marshadow,404,404,Gengar,耿鬼,Gengar,404,404,Sableye,勾魂眼,Sableye,404,404,Duskull,夜巡靈,Duskull,404,404,1,
237,2,50,297,Which of the following Pokémons can fly?,以下精靈中哪只能飛？,Which of the following Pokémons can fly?,404,404,Farfetch'd,大蔥鴨,Farfetch'd,404,404,Archen,始祖小鳥,Archen,404,404,Doduo,嘟嘟,Doduo,404,404,Natu,天然雀,Natu,404,404,1,
238,3,50,325,What is the temperature of the spark from Torchic's mouth?,火稚雞從嘴裏噴射出的火花溫度可以達到多少？,What is the temperature of the spark from Torchic's mouth?,404,404,1000°,1000°,1000°,404,404,500°,500°,500°,404,404,800°,800°,800°,404,404,1300°,1300°,1300°,404,404,1,
239,3,50,326,"There are three legendary Pokémons called ""The Being of Willpowerl"", ""The Being of Emotion"" and ""The Being of Knowledge"". Who represents the ""The Being of Knowledge""?","有三只傳說精靈分別被稱為""意誌之神""、""感情之神""、""知識之神""，請問是誰代表著""知識之神""？","There are three legendary Pokémons called ""The Being of Willpowerl"", ""The Being of Emotion"" and ""The Being of Knowledge"". Who represents the ""The Being of Knowledge""?",404,404,Uxie,由克希,Uxie,404,404,Mesprit,艾姆利多,Mesprit,404,404,Azelf,亞克諾姆,Azelf,404,404,Dialga,帝牙盧卡,Dialga,404,404,1,
240,3,50,327,Which of the following Pokémons can perceive when the Pokémon egg hatches through its tentacles?,以下哪只精靈可通過自己的觸角感知精靈蛋何時孵化？,Which of the following Pokémons can perceive when the Pokémon egg hatches through its tentacles?,404,404,Audino,差不多娃娃,Audino,404,404,Blissey,幸福蛋,Blissey,404,404,Octillery,章魚桶,Octillery,404,404,Swoobat,心蝙蝠,Swoobat,404,404,1,
241,3,50,328,Which of the following is the way to keep Swirlix from getting angry?,以下哪個是可以讓綿綿泡芙不會鬧脾氣的方法？,Which of the following is the way to keep Swirlix from getting angry?,404,404,Need to eat sugar of the same weight as its own weight,需要吃掉與自己體重相同重量的砂糖,Need to eat sugar of the same weight as its own weight,404,404,Need to eat a lot of fruit,需要吃大量的水果,Need to eat a lot of fruit,404,404,Needs trainer to massage its head,需要訓練家的按摩它的頭部,Needs trainer to massage its head,404,404,I need to eat a Poké puff every day,每天都需要吃一個精靈泡芙,I need to eat a Poké puff every day,404,404,1,
242,3,50,329,"There is an Pokémon who lives on the cold land of ancient times and when it screams, there will be aurora in the night sky. What it this Pokémon?",有一只精靈會生活在古代寒冷的土地上鳴叫的時候夜空中會出現極光。請問它是？,"There is an Pokémon who lives on the cold land of ancient times and when it screams, there will be aurora in the night sky. What it this Pokémon?",404,404,Amaura,冰雪龍,Amaura,404,404,Articuno,急凍鳥,Articuno,404,404,Dragonair,哈克龍,Dragonair,404,404,Avalugg,冰巖怪,Avalugg,404,404,1,
243,3,50,330,"It is said that Legendary Pokémon Xerneas is able to share its eternal life, sleep for a period like a tree and then resurrect. How long does it need to sleep?",傳說精靈哲爾尼亞斯據說能夠分享出永恒的生命，並以樹木的樣子沈睡一段時間後復活，請問沈睡多久？,"It is said that Legendary Pokémon Xerneas is able to share its eternal life, sleep for a period like a tree and then resurrect. How long does it need to sleep?",404,404,1000 years,1000年,1000 years,404,404,1500 years,1500年,1500 years,404,404,2000 years,2000年,2000 years,404,404,3000 years,3000年,3000 years,404,404,1,
244,3,50,331,Anorith swim in the ancient sea by twisting the wings that grow on its sides. How many wings are there?,太古羽蟲會通過扭動長在體側的翅膀在遠古的大海裏遊動，請問他體側有多少個翅膀？,Anorith swim in the ancient sea by twisting the wings that grow on its sides. How many wings are there?,404,404,Eight,8個,Eight,404,404,Six,6個,Six,404,404,Four,4個,Four,404,404,Ten,10個,Ten,404,404,1,
245,3,50,332,Spiritomb was bound to a fissure in an Odd Keystone as punishment for misdeeds 500 years ago. and it was formed by a lot of souls. How many souls are there?,花巖怪因為500年前作惡多端，導致身體被綁縛在楔石的裂縫裏，並且裝載著大量魂魄在內。請問裝載了多少個魂魄？,Spiritomb was bound to a fissure in an Odd Keystone as punishment for misdeeds 500 years ago. and it was formed by a lot of souls. How many souls are there?,404,404,108,108個,108,404,404,112,112個,112,404,404,136,136個,136,404,404,173,173個,173,404,404,1,
246,3,50,333,Woobat will sleep on the cave wall with its nostrils adsorbing on it. What traces will be left in the place where it has been adsorbed?,滾滾蝙蝠會用鼻孔吸附在洞穴巖壁上睡覺，請問吸附過的地方會留下什麽痕跡？,Woobat will sleep on the cave wall with its nostrils adsorbing on it. What traces will be left in the place where it has been adsorbed?,404,404,Heart-shaped,心形,Heart-shaped,404,404,Round shape,圓形,Round shape,404,404,Two points,兩個點,Two points,404,404,Square,方形,Square,404,404,1,
247,3,50,334,Which one of the following descriptions of the leaves on the head of Petilil is incorrect?,以下關於百合根娃娃頭頂的葉子描述不正確的是哪一項?,Which one of the following descriptions of the leaves on the head of Petilil is incorrect?,404,404,It tastes fragrant and delicious,咬起來清香可口,It tastes fragrant and delicious,404,404,Bitter tasted,咬起來很苦,Bitter tasted,404,404,Relieve body fatigue after use,使用後緩解身體疲勞,Relieve body fatigue after use,404,404,Mental recovery after use,使用後精神恢復,Mental recovery after use,404,404,1,
248,3,50,335,Which of the following statements about Krokorok’s eyeballs is wrong?,以下關於混混鱷眼球膜說法錯誤的是？,Which of the following statements about Krokorok’s eyeballs is wrong?,404,404,Can shine in the dark,在黑夜中可以發光,Can shine in the dark,404,404,Effectively protect your eyes in sandstorms,在沙暴中有效保護眼睛,Effectively protect your eyes in sandstorms,404,404,Can sense the heat of the object,可以感知物體的熱度,Can sense the heat of the object,404,404,Able to see my surroundings even in the dark,在黑暗中也能看見周圍,Able to see my surroundings even in the dark,404,404,1,
249,3,50,336,"Yamask will hold a mask all the time, because this mask is?",哭哭面具無時無刻都會拿著一個面具，因為這個面具是？,"Yamask will hold a mask all the time, because this mask is?",404,404,The face when it was still a human,還是人類時的臉,The face when it was still a human,404,404,Has great energy,有著巨大的能量,Has great energy,404,404,"Because it has no body, it is used for decoration",因為沒有身體，用來裝飾,"Because it has no body, it is used for decoration",404,404,Pasted on the body and cannot be taken off,粘貼在身上無法拿下來,Pasted on the body and cannot be taken off,404,404,1,
250,3,50,337,"Which of the following Pokémons is called the ancestor of bird Pokémons, has wings but can't fly?",以下哪只精靈被稱為鳥精靈的祖先，有翅膀但不會飛？,"Which of the following Pokémons is called the ancestor of bird Pokémons, has wings but can't fly?",404,404,Archen,始祖小鳥,Archen,404,404,Pidgey,波波,Pidgey,404,404,Taillow,傲骨燕,Taillow,404,404,Aerodactyl,化石翼龍,Aerodactyl,404,404,1,
251,3,50,338,Kricketot is a cricket Pokémon which can make a pleasant tone by shaking his head back and forth and tentacles colliding with each other. What musical instrument does this sound like?,圓法師是蟋蟀精靈，會通過前後晃動腦袋、觸角互相碰撞發出悅人的音色。請問這個碰撞聲和什麽樂器很像？,Kricketot is a cricket Pokémon which can make a pleasant tone by shaking his head back and forth and tentacles colliding with each other. What musical instrument does this sound like?,404,404,Xylophone,木琴,Xylophone,404,404,Bells,鈴鐺,Bells,404,404,Flute,笛子,Flute,404,404,Triangle,三角鐵,Triangle,404,404,1,
252,3,50,339,Which of the following statements about Minior is incorrect?,下列關於小隕星說法不正確的是？,Which of the following statements about Minior is incorrect?,404,404,The body will become heavier after Minior shatters its shell,小隕星碎掉外殼後身體會變得更重,The body will become heavier after Minior shatters its shell,404,404,The core of Minior has 7 colors,小隕星內核有7種顏色,The core of Minior has 7 colors,404,404,"Miniors has two type, Rock and Flying",小隕星是巖石飛行兩種屬性,"Miniors has two type, Rock and Flying",404,404,The outer shell of Minior is formed by absorbing a lot of dust particles,小隕星的外殼是吸取了很多塵粒形成的,The outer shell of Minior is formed by absorbing a lot of dust particles,404,404,1,
253,3,50,340,"In anime, there are many islands in the Alola Region, and there will also be an exclusive guardian on the islands. Tapu Bulu is one of them. Which island does it guard?",動畫中，阿羅拉地區有眾多島嶼，島嶼上也會有專屬的守護神。卡噗 · 哞哞就是其中之一，請問它守護的哪一個島嶼？,"In anime, there are many islands in the Alola Region, and there will also be an exclusive guardian on the islands. Tapu Bulu is one of them. Which island does it guard?",404,404,Ula'ula Island,烏拉烏拉島,Ula'ula Island,404,404,Poni Island,波尼島,Poni Island,404,404,Akala Island,阿卡拉島,Akala Island,404,404,Melemele Island,美樂美樂島,Melemele Island,404,404,1,
254,3,50,340,"In movie [Wishing Star of the Seven Nights], whose innocence awakens Jirachi?",劇場版動畫【七夜的許願星 基拉祈】中是誰的純真之心喚醒了基拉祈？,"In movie [Wishing Star of the Seven Nights], whose innocence awakens Jirachi?",404,404,Max,小勝,Max,404,404,Misty,小霞,Misty,404,404,Ash,小智,Ash,404,404,Brock,小剛,Brock,404,404,1,
255,3,50,340,"Who was called the ""Aura Warrior"" in the movie ""Lucario and the Mystery of Mew"" in the Pokémon battle long ago?",劇場版動畫【夢幻與波導的勇者】中在很久以前的精靈大戰中被稱為“波導的勇者”的是誰？,"Who was called the ""Aura Warrior"" in the movie ""Lucario and the Mystery of Mew"" in the Pokémon battle long ago?",404,404,Sir Aaron,亞朗,Sir Aaron,404,404,May,小遙,May,404,404,Kidd Summers,琪朵·夏瑪茲,Kidd Summers,404,404,Mime Jr.,摩尼尼,Mime Jr.,404,404,1,
256,3,50,340,Which two Pokémons did Mew suddenly appear and took away in movie [Lucario and the Mystery of Mew]?,劇場版動畫【夢幻與波導的勇者】中夢幻突然出現帶走了哪兩只精靈？,Which two Pokémons did Mew suddenly appear and took away in movie [Lucario and the Mystery of Mew]?,404,404,Pikachu and Meowth,皮卡丘和喵喵,Pikachu and Meowth,404,404,Pikachu and Treecko,皮卡丘和木守宮,Pikachu and Treecko,404,404,Meowth and Chimecho,喵喵和風鈴鈴,Meowth and Chimecho,404,404,Wobbuffet and Pikachu,果然翁和皮卡丘,Wobbuffet and Pikachu,404,404,1,
257,3,50,340,"In movie [The Rise of Darkrai], there is a Pokémon in Alamos Town that can make Pokémons faint and have nightmares. Which Pokémon is it?",劇場版動畫【決戰時空之塔】中白楊鎮出現了一只能讓精靈們昏厥並產生惡夢的精靈，請問是哪只來歷不明的精靈？,"In movie [The Rise of Darkrai], there is a Pokémon in Alamos Town that can make Pokémons faint and have nightmares. Which Pokémon is it?",404,404,Darkrai,達克萊伊,Darkrai,404,404,Dialga,帝牙盧卡,Dialga,404,404,Palkia,帕路奇亞,Palkia,404,404,Hoopa,胡帕,Hoopa,404,404,1,
258,3,50,341,"In movie [Arceus and the Jewel of Life] What is the fifth Legendary Pokémon to appear after Arceus, Dialga, Palkia, and Giratina?",劇場版動畫【阿爾宙斯超克的時空】中繼阿爾宙斯、帝牙盧卡、帕路奇亞和騎拉帝納後第五只登場的傳說精靈是什麽？,"In movie [Arceus and the Jewel of Life] What is the fifth Legendary Pokémon to appear after Arceus, Dialga, Palkia, and Giratina?",404,404,Heatran,席多藍恩,Heatran,404,404,Mewtwo,超夢,Mewtwo,404,404,Mew,夢幻,Mew,404,404,Groudon,固拉多,Groudon,404,404,1,
259,3,50,341,"In movie [Pokémon Ranger and the Temple of the Sea], who did Manaphy think is his mother?",劇場版動畫【精靈巡護員與蒼海的王子】中瑪納霏曾認定誰是媽媽？,"In movie [Pokémon Ranger and the Temple of the Sea], who did Manaphy think is his mother?",404,404,May,小遙,May,404,404,Misty,小霞,Misty,404,404,Dawn,小光,Dawn,404,404,Max,小勝,Max,404,404,1,
260,3,50,341,In movie [Deoxys the Visitor] Who is the target of Deoxys's to fight with?,劇場版動畫【裂空的訪問者 代歐奇希斯】中代歐奇希斯的戰鬥對象是誰？,In movie [Deoxys the Visitor] Who is the target of Deoxys's to fight with?,404,404,Rayquaza,裂空座,Rayquaza,404,404,Groudon,固拉多,Groudon,404,404,Kyogre,蓋歐卡,Kyogre,404,404,Ho-Oh,鳳王,Ho-Oh,404,404,1,
261,3,50,341,"In movie [Zoroark: Master of Illusions], which legendary Pokémon is raging on the streets?",劇場版動畫【幻影的霸者 索羅亞克】中哪幾只神獸在街道上暴走？,"In movie [Zoroark: Master of Illusions], which legendary Pokémon is raging on the streets?",404,404,"Raikou, Entei, Suicune",雷公，炎帝，水君,"Raikou, Entei, Suicune",404,404,"Moltres, Zapdos, Articuno",火焰鳥，閃電鳥，急凍鳥,"Moltres, Zapdos, Articuno",404,404,"Regirock, Registeel, Regice",雷吉洛克，雷吉斯奇魯，雷吉艾斯,"Regirock, Registeel, Regice",404,404,"Dialga, Palkia, Giratina",帝牙盧卡，帕路奇亞，騎拉帝納,"Dialga, Palkia, Giratina",404,404,1,
262,3,50,341,"In movie [Kyurem VS. The Sword of Justice], whose power can Kyurem combine and transformed into another form?",劇場版動畫【酋雷姆VS聖劍士 凱路迪歐】中酋雷姆可以結合誰的力量轉變成別的形態？,"In movie [Kyurem VS. The Sword of Justice], whose power can Kyurem combine and transformed into another form?",404,404,"Zekrom, Reshiram",捷克羅姆，萊希拉姆,"Zekrom, Reshiram",404,404,"Palkia, Dialga",帕路奇亞，帝牙盧卡,"Palkia, Dialga",404,404,"Groudon, Kyogre",固拉多，蓋歐卡,"Groudon, Kyogre",404,404,"Mew, Mewtwo",夢幻，超夢,"Mew, Mewtwo",404,404,1,
263,3,50,342,In movie [Arceus and the Jewel of Life] Ash and his party travel through time and space under whose help?,劇場版動畫【阿爾宙斯 超克的時空】在誰的幫助下小智一行人穿越時空？,In movie [Arceus and the Jewel of Life] Ash and his party travel through time and space under whose help?,404,404,Dialga,帝牙盧卡,Dialga,404,404,Palkia,帕路奇亞,Palkia,404,404,Giratina,騎拉帝納,Giratina,404,404,Arceus,阿爾宙斯,Arceus,404,404,1,
264,3,50,342,"In the movie [Giratina and the Sky Warrior], what is the reason Giratina is tracking Dialga?",劇場版動畫【騎拉帝納與冰空的花束】中騎拉帝納追蹤帝牙盧卡的原因是什麽？,"In the movie [Giratina and the Sky Warrior], what is the reason Giratina is tracking Dialga?",404,404,Because the Reverse World is polluted,因為反轉世界受到了汙染,Because the Reverse World is polluted,404,404,Because of past grudges,因為以往的恩怨,Because of past grudges,404,404,Because they have the ability to travel through time and space,因為都有時空穿梭的能力,Because they have the ability to travel through time and space,404,404,Retake certain items from Dialga,奪回帝牙盧卡身上的某些物品,Retake certain items from Dialga,404,404,1,
265,3,50,342,What is the favorite food of Hoopa Confined in movie [Hoopa and the Clash of Ages] ?,劇場版動畫【光環的超魔神】中主角懲戒胡帕最喜歡吃的食物是？,What is the favorite food of Hoopa Confined in movie [Hoopa and the Clash of Ages] ?,404,404,Donuts,甜甜圈,Donuts,404,404,Macaron,馬卡龍,Macaron,404,404,Strawberry Cake,草莓蛋糕,Strawberry Cake,404,404,Icing bread,糖霜面包,Icing bread,404,404,1,
266,3,50,342,"In movie [Spell of the Unown], in the end of the movie, Ash and his partners bid farewell toLisa. Moli gets a Pokémon and reunites with her father. Which Pokémon is it?",劇場版動畫【結晶塔的帝王】中片尾中小智一行人與小淩告別，小美得到了一只精靈並與父親重逢。請問是哪只精靈？,"In movie [Spell of the Unown], in the end of the movie, Ash and his partners bid farewell toLisa. Moli gets a Pokémon and reunites with her father. Which Pokémon is it?",404,404,Teddiursa,熊寶寶,Teddiursa,404,404,Pichu,皮丘,Pichu,404,404,Plusle,正電拍拍,Plusle,404,404,Butterfree,巴大蝶,Butterfree,404,404,1,
267,3,50,342,"In movie [Lucario and the Mystery of Mew], Ash entered the tree of beginning in order to find Pikachu, but was swallowed by the tree as an invading bacteria. Who saved Ash in the end?",劇場版動畫【夢幻與波導的勇者路卡利歐】中，小智為了尋找皮卡丘進入世界初始之樹中、卻被世界樹當成入侵細菌吞噬，請問最後是誰救了小智？,"In movie [Lucario and the Mystery of Mew], Ash entered the tree of beginning in order to find Pikachu, but was swallowed by the tree as an invading bacteria. Who saved Ash in the end?",404,404,Mew,夢幻,Mew,404,404,Mewtwo,超夢,Mewtwo,404,404,Celebi,時拉比,Celebi,404,404,Pikachu,皮卡丘,Pikachu,404,404,1,
268,1,50,160,"[Common sense] The ""one day"" we often say refers to:",【常識】我們常說的“一日”是指：,"[Common sense] The ""one day"" we often say refers to:",404,404,The time of the earth's rotation,地球自轉一周的時間,The time of the earth's rotation,404,404,The time of the earth's revolution,地球公轉一周的時間,The time of the earth's revolution,404,404,Half time of the earth's revolution,地球公轉半周的時間,Half time of the earth's revolution,404,404,The time for the earth half rotation,地球自轉半周的時間,The time for the earth half rotation,404,404,1,
269,1,50,161,[Common Sense] What is the abbreviation of the central processing unit of a computer?,【常識】電腦的中央處理器英文縮寫是？,[Common Sense] What is the abbreviation of the central processing unit of a computer?,404,404,CPU,CPU,CPU,404,404,GDP,GDP,GDP,404,404,NBA,NBA,NBA,404,404,CPV,CPV,CPV,404,404,1,
270,1,50,162,[Common Sense] Which one is heavier? 1 pound of Iron or 1 pound of wood?,【常識】一千克鐵和一千克木頭哪個重？,[Common Sense] Which one is heavier? 1 pound of Iron or 1 pound of wood?,404,404,Same weight,一樣重,Same weight,404,404,Wood,木頭,Wood,404,404,Iron,鐵,Iron,404,404,Not comparable,沒有可比性,Not comparable,404,404,1,
271,2,50,346,[Common sense] Which of the following products of photosynthesis are not synthesized in the chloroplast?,【常識】下列在光合作用的產物中，不在葉綠體內合成的是？,[Common sense] Which of the following products of photosynthesis are not synthesized in the chloroplast?,404,404,Cane sugar,蔗糖,Cane sugar,404,404,Starch,澱粉,Starch,404,404,Protein,蛋白質,Protein,404,404,Fat,脂質,Fat,404,404,1,
272,2,50,347,[Common sense] Which of the following statements about inertia is correct?,【常識】下列關於慣性的說法中，正確的是？,[Common sense] Which of the following statements about inertia is correct?,404,404,"The greater the mass of the object, the greater the inertia",物體的質量越大，慣性越大,"The greater the mass of the object, the greater the inertia",404,404,"The greater the external force on the object, the greater the inertia",物體所受合外力越大，慣性越大,"The greater the external force on the object, the greater the inertia",404,404,The inertia disappears when the object moves in free fall,物體做自由落體運動時慣性消失,The inertia disappears when the object moves in free fall,404,404,"The greater the speed of the object, the greater the inertia",物體的速度越大，慣性越大,"The greater the speed of the object, the greater the inertia",404,404,1,
273,2,50,349,[Common Sense] What is the 12th digit after the decimal point of Pi?,【常識】圓周率小數點後第12位是？,[Common Sense] What is the 12th digit after the decimal point of Pi?,404,404,9,9,9,404,404,8,8,8,404,404,5,5,5,404,404,4,4,4,404,404,1,
274,2,50,354,[Common Sense] What is the English abbreviation of Local Area Network?,【常識】局域網的英文縮寫是？,[Common Sense] What is the English abbreviation of Local Area Network?,404,404,LAN,LAN,LAN,404,404,ADSL,ADSL,ADSL,404,404,MAC,MAC,MAC,404,404,Internet,Internet,Internet,404,404,1,
275,2,50,357,[Common sense] What is the maximum safe voltage for the human body?,【常識】對人體來說安全電壓最大值為多少？,[Common sense] What is the maximum safe voltage for the human body?,404,404,36,36,36,404,404,37,37,37,404,404,38,38,38,404,404,40,40,40,404,404,1,
276,3,50,351,"[Common sense] In nature, what is called the ""element of wisdom""?",【常識】自然界中，有“智慧元素”之稱的是？,"[Common sense] In nature, what is called the ""element of wisdom""?",404,404,Iodine,碘,Iodine,404,404,Iron,鐵,Iron,404,404,Calcium,鈣,Calcium,404,404,Zinc,鋅,Zinc,404,404,1,
277,3,50,352,[Common sense] Dutch windmills are mainly used for?,【常識】荷蘭的風車主要用於？,[Common sense] Dutch windmills are mainly used for?,404,404,Drain,排水,Drain,404,404,Sightseeing,觀光,Sightseeing,404,404,Power generation,發電,Power generation,404,404,Generate wind,生風,Generate wind,404,404,1,
